Twitter for iPhone,HAPPY NEW YEAR! https://t.co/bHoPDPQ7G6,12-31-2018 23:53:06,32999,132907,false,1079888205351145472
Twitter for iPhone,Heads of countries are calling wanting to know why Senator Schumer is not approving their otherwise approved Ambassadors!? Likewise in Government lawyers and others are being delayed at a record pace! 360 great and hardworking people are waiting for approval from....,12-31-2018 20:02:52,20519,74566,false,1079830267274108930
Twitter for iPhone,....Senator Schumer more than a year longer than any other Administration in history. These are people who have been approved by committees and all others yet Schumer continues to hold them back from serving their Country! Very Unfair!,12-31-2018 20:02:52,17027,63013,false,1079830268708556800
Twitter for iPhone,It’s incredible how Democrats can all use their ridiculous sound bite and say that a Wall doesn’t work. It does and properly built almost 100%! They say it’s old technology - but so is the wheel. They now say it is immoral- but it is far more immoral for people to be dying!,12-31-2018 15:39:15,29355,125931,false,1079763923845419009
Twitter for iPhone,I’m in the Oval Office. Democrats come back from vacation now and give us the votes necessary for Border Security including the Wall. You voted yes in 2006 and 2013. One more yes but with me in office I’ll get it built and Fast!,12-31-2018 15:37:14,30742,131151,false,1079763419908243456
Twitter for iPhone,I’m in the Oval Office. Democrats come back from vacation now and give us the votes necessary for Border Security including the Wall. You voted yes in 2006 and 3013. One more yes but with me in office I’ll get it built and Fast!,12-31-2018 15:33:15,1123,4217,false,1079762413589807104
Twitter for iPhone,I am the only person in America who could say that “I’m bringing our great troops back home with victory” and get BAD press. It is Fake News and Pundits who have FAILED for years that are doing the complaining. If I stayed in Endless Wars forever they would still be unhappy!,12-31-2018 14:38:52,25252,111582,false,1079748730058870789
Twitter for iPhone,I campaigned on Border Security which you cannot have without a strong and powerful Wall. Our Southern Border has long been an “Open Wound” where drugs criminals (including human traffickers) and illegals would pour into our Country. Dems should get back here an fix now!,12-31-2018 13:29:32,21960,90883,false,1079731279032172545
Twitter for iPhone,.....Except the results are FAR BETTER than I ever said they were going to be! I campaigned against the NEVER ENDING WARS remember!,12-31-2018 13:19:13,15081,72353,false,1079728684427341825
Twitter for iPhone,...I campaigned on getting out of Syria and other places. Now when I start getting out the Fake News Media or some failed Generals who were unable to do the job before I arrived like to complain about me &amp; my tactics which are working. Just doing what I said I was going to do!,12-31-2018 13:12:40,22000,100819,false,1079727034673311746
Twitter for iPhone,If anybody but Donald Trump did what I did in Syria which was an ISIS loaded mess when I became President they would be a national hero. ISIS is mostly gone we’re slowly sending our troops back home to be with their families while at the same time fighting ISIS remnants......,12-31-2018 13:03:05,17379,79095,false,1079724622868819973
Twitter for iPhone,An all concrete Wall was NEVER ABANDONED as has been reported by the media. Some areas will be all concrete but the experts at Border Patrol prefer a Wall that is see through (thereby making it possible to see what is happening on both sides). Makes sense to me!,12-31-2018 12:51:22,20779,96655,false,1079721675346923520
Twitter for iPhone,President and Mrs. Obama built/has a ten foot Wall around their D.C. mansion/compound. I agree totally necessary for their safety and security. The U.S. needs the same thing slightly larger version!,12-30-2018 21:59:44,61730,233299,false,1079497288605683712
Twitter for iPhone,Great work by my Administration over the holidays to save Coast Guard pay during this #SchumerShutdown. No thanks to the Democrats who left town and are not concerned about the safety and security of Americans!,12-30-2018 16:56:09,32041,130761,false,1079420891807793152
Twitter for iPhone,Veterans on President Trump’s handling of Border Security - 62% Approval Rating. On being a strong leader - 59%.  AP Poll. Thank you!,12-30-2018 15:28:35,25749,123564,false,1079398853684707328
Twitter for iPhone,“It turns out to be true now that the Department of Justice and the FBI under President Obama rigged the investigation for Hillary and really turned the screws on Trump and now it looks like in a corrupt &amp; illegal way. The facts are out now. Whole Hoax exposed. @JesseBWatters,12-30-2018 03:15:36,44877,150051,false,1079214392758145024
Twitter for iPhone,“Absolutely nothing” (on Russian Collusion). Kimberley Strassel The Wall Street Journal. The Russian Collusion fabrication is the greatest Hoax in the history of American politics. The only Russian Collusion was with Hillary and the Democrats!,12-30-2018 03:01:28,30777,118155,false,1079210835963195392
Twitter for iPhone,2018 is being called “THE YEAR OF THE WORKER” by Steve Moore co-author of “Trumponomics.” It was indeed a great year for the American Worker with the “best job market in 50 years and the lowest unemployment rate ever for blacks and Hispanics and all workers. Big wage gains.”,12-29-2018 21:06:08,25797,109238,false,1079121410935660544
Twitter for iPhone,For those that naively ask why didn’t the Republicans get approval to build the Wall over the last year it is because IN THE SENATE WE NEED 10 DEMOCRAT VOTES and they will gives us “NONE” for Border Security! Now we have to do it the hard way with a Shutdown. Too bad! @FoxNews,12-29-2018 19:25:47,34525,144271,false,1079096156708319232
Twitter for iPhone,...children in question were very sick before they were given over to Border Patrol. The father of the young girl said it was not their fault he hadn’t given her water in days. Border Patrol needs the Wall and it will all end. They are working so hard &amp; getting so little credit!,12-29-2018 18:36:17,30202,129715,false,1079083702943211520
Twitter for iPhone,Any deaths of children or others at the Border are strictly the fault of the Democrats and their pathetic immigration policies that allow people to make the long trek thinking they can enter our country illegally. They can’t. If we had a Wall they wouldn’t even try! The two.....,12-29-2018 18:30:16,29363,120614,false,1079082188665171971
Twitter for iPhone,Just had a long and very good call with President Xi of China. Deal is moving along very well. If made it will be very comprehensive covering all subjects areas and points of dispute. Big progress being made!,12-29-2018 16:03:02,27724,142064,false,1079045134061371392
Twitter for iPhone,I am in the White House waiting for the Democrats to come on over and make a deal on Border Security. From what I hear they are spending so much time on Presidential Harassment that they have little time left for things like stopping crime and our military!,12-29-2018 15:52:24,30009,127523,false,1079042460800696320
Twitter for iPhone,The Mueller Angry Democrats recently deleted approximately 19000 Text messages between FBI Agent Lisa Page and her lover Agent Peter S. These Texts were asked for and INVALUABLE to the truth of the Witch Hunt Hoax. This is a total Obstruction of Justice. All Texts Demanded!,12-29-2018 15:42:50,32048,112010,false,1079040052234203141
Twitter for iPhone,Thank you to Sean Parnell for the nice comments on @foxandfriends about the troops wonderful reaction to Melania and I in Iraq and Germany. Great things are happening!,12-28-2018 14:51:07,21407,113861,false,1078664648726061056
Twitter for iPhone,.....Honduras Guatemala and El Salvador are doing nothing for the United States but taking our money. Word is that a new Caravan is forming in Honduras and they are doing nothing about it. We will be cutting off all aid to these 3 countries - taking advantage of U.S. for years!,12-28-2018 13:06:13,39548,167132,false,1078638249562775552
Twitter for iPhone,.....close the Southern Border. Bring our car industry back into the United States where it belongs. Go back to pre-NAFTA before so many of our companies and jobs were so foolishly sent to Mexico. Either we build (finish) the Wall or we close the Border......,12-28-2018 12:49:26,25309,108158,false,1078634025412116480
Twitter for iPhone,....The United States looses soooo much money on Trade with Mexico under NAFTA over 75 Billion Dollars a year (not including Drug Money which would be many times that amount) that I would consider closing the Southern Border a “profit making operation.” We build a Wall or.....,12-28-2018 12:42:12,23736,101103,false,1078632205210058752
Twitter for iPhone,We will be forced to close the Southern Border entirely if the Obstructionist Democrats do not give us the money to finish the Wall &amp; also change the ridiculous immigration laws that our Country is saddled with. Hard to believe there was a Congress &amp; President who would approve!,12-28-2018 12:16:40,36280,156425,false,1078625779670503426
Twitter for iPhone,CNN &amp; others within the Fake News Universe were going wild about my signing MAGA hats for our military in Iraq and Germany. If these brave young people ask me to sign their hat I will sign. Can you imagine my saying NO? We brought or gave NO hats as the Fake News first reported!,12-27-2018 23:23:36,43772,181435,false,1078431231262502912
Twitter for iPhone,This isn’t about the Wall everybody knows that a Wall will work perfectly (In Israel the Wall works 99.9%). This is only about the Dems not letting Donald Trump &amp; the Republicans have a win. They may have the 10 Senate votes but we have the issue Border Security. 2020!,12-27-2018 22:10:07,31406,127902,false,1078412737603096576
Twitter for iPhone,Brad Blakeman: “The American people understand that we have been played by foreign actors who would rather have us fight their battles for them. The President says look this is your neighborhood you’ve got to stand up to protect yourselves. Don’t always look to America.”,12-27-2018 21:26:10,19646,85166,false,1078401678930558976
Twitter for iPhone,Brad Blakeman: “The American people understand that we have been played by foreign actors who would rather have us fight their battles for them. The Pesident says look this is your neighborhood you’ve got to stand up to protect yourselves. Don’t always look to America.”,12-27-2018 21:13:15,2510,9448,false,1078398427661250562
Twitter for iPhone,I totally agree! https://t.co/KO8E3bfWfn,12-27-2018 21:04:24,45963,179981,false,1078396200842395648
Twitter for iPhone,There is right now a full scale manhunt going on in California for an illegal immigrant accused of shooting and killing a police officer during a traffic stop. Time to get tough on Border Security. Build the Wall!,12-27-2018 21:04:06,36523,146277,false,1078396126619930624
Twitter for iPhone,“Border Patrol Agents want the Wall.” Democrat’s say they don’t want the Wall (even though they know it is really needed) and they don’t want ICE. They don’t have much to campaign on do they? An Open Southern Border and the large scale crime that comes with such stupidity!,12-27-2018 20:39:59,24281,105281,false,1078390057906638853
Twitter for iPhone,The reason the DACA for Wall deal didn’t get done was that a ridiculous court decision from the 9th Circuit allowed DACA to remain thereby setting up a Supreme Court case. After ruling Dems dropped deal - and that’s where we are today Democrat obstruction of the needed Wall.,12-27-2018 19:44:49,21140,81965,false,1078376171845361665
Twitter for iPhone,The Democrats OBSTRUCTION of the desperately needed Wall where they almost all recently agreed it should be built is exceeded only by their OBSTRUCTION of 350 great people wanting &amp; expecting to come into Government after being delayed for more than two years a U.S. record!,12-27-2018 19:41:45,20172,84780,false,1078375400974307328
Twitter for iPhone,The reason the DACA for Wall deal didn’t get done was that a ridiculous court decision from the 9th Circuit allowed DACA to remain thereby setting up a Supteme Court case. After ruling Dems dropped deal - and that’s where we are today Democrat obstruction of the needed Wall.,12-27-2018 19:35:46,2339,8218,false,1078373893822431233
Twitter for iPhone,Have the Democrats finally realized that we desperately need Border Security and a Wall on the Southern Border. Need to stop Drugs Human TraffickingGang Members &amp; Criminals from coming into our Country. Do the Dems realize that most of the people not getting paid are Democrats?,12-27-2018 12:06:25,30542,131861,false,1078260814157701121
Twitter for iPhone,Just returned from visiting our troops in Iraq and Germany. One thing is certain we have incredible people representing our Country - people that know how to win!,12-27-2018 11:59:04,29623,168756,false,1078258964796706816
Twitter for iPhone,.@FLOTUS Melania and I were honored to visit our incredible troops at Al Asad Air Base in Iraq. GOD BLESS THE U.S.A.! https://t.co/rDlhITDvm1,12-26-2018 20:35:25,50441,222873,false,1078026520021544960
Twitter for iPhone,I hope everyone even the Fake News Media is having a great Christmas! Our Country is doing very well. We are securing our Borders making great new Trade Deals and bringing our Troops Back Home. We are finally putting America First. MERRY CHRISTMAS!  #MAGA,12-25-2018 23:18:44,46596,249842,false,1077705232665272321
Twitter for iPhone,Merry Christmas!,12-25-2018 12:59:08,89254,508327,false,1077549301449060352
Twitter for iPhone,RT @FLOTUS: Helping children across the country track #Santa is becoming one of my favorite traditions!  @Potus and I enjoyed working with…,12-25-2018 02:28:40,24694,0,true,1077390639766081541
Twitter for iPhone,I am in the Oval Office &amp; just gave out a 115 mile long contract for another large section of the Wall in Texas. We are already building and renovating many miles of Wall some complete. Democrats must end Shutdown and finish funding. Billions of Dollars &amp; lives will be saved!,12-24-2018 22:24:13,41153,182040,false,1077329121745793025
Twitter for iPhone,Christmas Eve briefing with my team working on North Korea – Progress being made. Looking forward to my next summit with Chairman Kim! https://t.co/zPTtDbrP0o,12-24-2018 21:14:12,17566,88627,false,1077311502615490560
Twitter for iPhone,I am all alone (poor me) in the White House waiting for the Democrats to come back and make a deal on desperately needed Border Security. At some point the Democrats not wanting to make a deal will cost our Country more money than the Border Wall we are all talking about. Crazy!,12-24-2018 17:32:44,37860,181954,false,1077255770725601280
Twitter for iPhone,Saudi Arabia has now agreed to spend the necessary money needed to help rebuild Syria instead of the United States. See? Isn’t it nice when immensely wealthy countries help rebuild their neighbors rather than a Great Country the U.S. that is 5000 miles away. Thanks to Saudi A!,12-24-2018 17:23:22,38832,156892,false,1077253411358326785
Twitter for iPhone,The Wall is different than the 25 Billion Dollars in Border Security. The complete Wall will be built with the Shutdown money plus funds already in hand. The reporting has been inaccurate on the point. The problem is without the Wall much of the rest of Dollars are wasted!,12-24-2018 17:10:22,25415,101326,false,1077250139503452162
Twitter for iPhone,I never “lashed out” at the Acting Attorney General of the U.S. a man for whom I have great respect. This is a made up story one of many by the Fake News Media!,12-24-2018 16:55:32,19239,88333,false,1077246407554281472
Twitter for iPhone,The only problem our economy has is the Fed. They don’t have a feel for the Market they don’t understand necessary Trade Wars or Strong Dollars or even Democrat Shutdowns over Borders. The Fed is like a powerful golfer who can’t score because he has no touch - he can’t putt!,12-24-2018 15:55:22,30508,125022,false,1077231267559755776
Twitter for iPhone,AMERICA IS RESPECTED AGAIN!,12-24-2018 15:33:41,28409,156718,false,1077225810329825281
Twitter for iPhone,For all of the sympathizers out there of Brett McGurk remember he was the Obama appointee who was responsible for loading up airplanes with 1.8 Billion Dollars in CASH &amp;  sending it to Iran as part of the horrific Iran Nuclear Deal (now terminated) approved by Little Bob Corker.,12-24-2018 15:23:22,28640,99077,false,1077223213598429185
Twitter for iPhone,....We are substantially subsidizing the Militaries of many VERY rich countries all over the world while at the same time these countries take total advantage of the U.S. and our TAXPAYERS on Trade. General Mattis did not see this as a problem. I DO and it is being fixed!,12-24-2018 14:59:23,25119,107521,false,1077217178322194432
Twitter for iPhone,To those few Senators who think I don’t like or appreciate being allied with other countries they are wrong I DO. What I don’t like however is when many of these same countries take advantage of their friendship with the United States both in Military Protection and Trade...,12-24-2018 14:41:02,22190,98796,false,1077212559604924416
Twitter for iPhone,Virtually every Democrat we are dealing with today strongly supported a Border Wall or Fence. It was only when I made it an important part of my campaign because people and drugs were pouring into our Country unchecked that they turned against it. Desperately needed!,12-24-2018 14:31:50,25312,108934,false,1077210242574942208
Twitter for iPhone,President @RT_Erdogan of Turkey has very strongly informed me that he will eradicate whatever is left of ISIS in Syria....and he is a man who can do it plus Turkey is right “next door.” Our troops are coming home!,12-24-2018 04:54:00,21687,97080,false,1077064829825966081
Twitter for iPhone,“The President has been remarkable. I do not doubt that he will thrive in this new environment and he will be a constant reminder of what populism is.” Thank you to Tammy Bruce and Steve Hilton. Presidential Harassment has been with me from the beginning!,12-24-2018 04:26:22,16101,78715,false,1077057874235400194
Twitter for iPhone,The most important way to stop gangs drugs human trafficking and massive crime is at our Southern Border. We need Border Security and as EVERYONE knows you can’t have Border Security without a Wall. The Drones &amp; Technology are just bells and whistles. Safety for America!,12-24-2018 04:05:26,24085,100773,false,1077052604499353600
Twitter for iPhone,Mitch McConnell just told a group of people and me that he has been in the U.S. Senate for 32 years and the last two have been by far the best &amp; most productive of his career. Tax &amp; Regulation Cuts VA Choice Farm Bill Criminal Justice Reform Judgeships &amp; much more. Great!,12-24-2018 03:47:21,26483,130325,false,1077048054862278656
Twitter for iPhone,“It should not be the job of America to replace regimes around the world. This is what President Trump recognized in Iraq that it was the biggest foreign policy disaster of the last several decades and he’s right...The generals still don’t get the mistake.”  @RandPaul,12-24-2018 03:32:49,22084,89820,false,1077044397504692227
Twitter for iPhone,RT @RSScott_BP252: USBP Agents will continue to diligently do their sworn duites through the holidays and the furlough -JUST LIKE EVERY OTH…,12-24-2018 00:42:22,1326,0,true,1077001502173089793
Twitter for iPhone,Thanks @RandPaul  “I am very proud of the President. This is exactly what he promised and I think the people agree with him. We’ve been at war too long and in too many places...spent several trillion dollars on these wars everywhere. He’s different...that’s why he got elected.”,12-23-2018 21:18:49,25268,109480,false,1076950276958027779
Twitter for iPhone,.....Bob Corker was responsible for giving us the horrible Iran Nuclear Deal which I ended yet he badmouths me for wanting to bring our young people safely back home. Bob wanted to run and asked for my endorsement. I said NO and the game was over. #MAGA I LOVE TENNESSEE!,12-23-2018 20:20:22,21647,97685,false,1076935567760338944
Twitter for iPhone,Senator Bob Corker just stated that “I’m so priveledged to serve in the Senate for twelve years and that’s what I told the people of our state that’s what I’d do serve for two terms.” But that is Not True - wanted to run but poll numbers TANKED when I wouldn’t endorse him.....,12-23-2018 19:56:37,16542,78517,false,1076929590050897920
Twitter for iPhone,We signed two pieces of major legislation this week Criminal Justice Reform and the Farm Bill. These are two Big Deals but all the Fake News Media wants to talk about is “the mistake” of bringing our young people back home from the Never Ending Wars. It all began 19 years ago!,12-23-2018 19:45:22,22964,94518,false,1076926760829243392
Twitter for iPhone,Unthinkable devastation from the tsunami disaster in Indonesia. More than two hundred dead and nearly a thousand injured or unaccounted for. We are praying for recovery and healing. America is with you!,12-23-2018 17:13:27,15979,79668,false,1076888530276810753
Twitter for iPhone,I just had a long and productive call with President @RT_Erdogan of Turkey. We discussed ISIS our mutual involvement in Syria &amp; the slow &amp; highly coordinated pullout of U.S. troops from the area. After many years they are coming home. We also discussed heavily expanded Trade.,12-23-2018 16:59:22,17811,80977,false,1076884984873607169
Twitter for iPhone,I am pleased to announce that our very talented Deputy Secretary of Defense Patrick Shanahan will assume the title of Acting Secretary of Defense starting January 1 2019. Patrick has a long list of accomplishments while serving as Deputy &amp; previously Boeing. He will be great!,12-23-2018 16:46:47,18488,87083,false,1076881816462737408
Twitter for iPhone,The only way to stop drugs gangs human trafficking criminal elements and much else from coming into our Country is with a Wall or Barrier. Drones and all of the rest are wonderful and lots of fun but it is only a good old fashioned Wall that works!,12-23-2018 14:17:54,32372,143510,false,1076844349860823042
Twitter for iPhone,When President Obama ingloriously fired Jim Mattis I gave him a second chance. Some thought I shouldn’t I thought I should. Interesting relationship-but I also gave all of the resources that he never really had. Allies are very important-but not when they take advantage of U.S.,12-23-2018 02:20:32,25500,115813,false,1076663817831153664
Twitter for iPhone,If anybody but your favorite President Donald J. Trump announced that after decimating ISIS in Syria we were going to bring our troops back home (happy &amp; healthy) that person would be the most popular hero in America. With me hit hard instead by the Fake News Media. Crazy!,12-23-2018 01:59:29,33844,153602,false,1076658521926656000
Twitter for iPhone,Brett McGurk who I do not know was appointed by President Obama in 2015. Was supposed to leave in February but he just resigned prior to leaving. Grandstander? The Fake News is making such a big deal about this nothing event!,12-23-2018 01:48:23,19475,86601,false,1076655729820471296
Twitter for iPhone,I will not be going to Florida because of the Shutdown - Staying in the White House!  #MAGA,12-22-2018 23:58:43,23909,121158,false,1076628127525294080
Twitter for iPhone,Senate adjourns until December 27th.,12-22-2018 21:12:02,14231,64919,false,1076586181897474048
Twitter for iPhone,I won an election said to be one of the greatest of all time based on getting out of endless &amp; costly foreign wars &amp; also based on Strong Borders which will keep our Country safe. We fight for the borders of other countries but we won’t fight for the borders of our own!,12-22-2018 20:28:21,40151,175564,false,1076575190899929088
Twitter for iPhone,The crisis of illegal activity at our Southern Border is real and will not stop until we build a great Steel Barrier or Wall. Let work begin!,12-22-2018 20:03:58,24788,111116,false,1076569051768516608
Twitter for iPhone,Will be having lunch in White House residence with large group concerning Border Security.,12-22-2018 17:02:37,17276,93759,false,1076523416516263936
Twitter for iPhone,....going to be there for three months and that was seven years ago - we never left. When I became President ISIS was going wild. Now ISIS is largely defeated and other local countries including Turkey should be able to easily take care of whatever remains. We’re coming home!,12-22-2018 16:30:35,25454,117921,false,1076515352249597954
Twitter for iPhone,I am in the White House working hard. News reports concerning the Shutdown and Syria are mostly FAKE. We are negotiating with the Democrats on desperately needed Border Security (Gangs Drugs Human Trafficking &amp; more) but it could be a long stay. On Syria we were originally...,12-22-2018 16:18:11,20944,90769,false,1076512233897771010
Twitter for iPhone,RT @realDonaldTrump: OUR GREAT COUNTRY MUST HAVE BORDER SECURITY! https://t.co/ZGcYygMf3a,12-22-2018 05:09:15,16325,0,true,1076343890473598976
Twitter for iPhone,OUR GREAT COUNTRY MUST HAVE BORDER SECURITY! https://t.co/ZGcYygMf3a,12-22-2018 02:49:05,38165,150175,false,1076308614372048897
Twitter for iPhone,Wishing Supreme Court Justice Ruth Bader Ginsburg a full and speedy recovery!,12-22-2018 00:16:55,16052,113554,false,1076270321861312512
